{
  "schema_version": "1.0.0",
  "signal_id": "sig_fixture_1",
  "event_id": "evt_fixture_1",
  "prediction_id": "pred_fixture_1",
  "machine_id": "M-001",
  "severity": "HIGH",
  "risk_score": 0.91,
  "model_version": "fixture-model-v1",
  "policy_version": "fixture-policy-v1",
  "decided_at": "2026-10-18T00:00:00Z",
  "correlation_id": "cor_fixture_1"
}
